{
  "$schema": "./hosted-result.schema.json",
  "schema_version": 1,
  "run": {
    "id": "20260711T150629Z-glm-5.2-hf-novita-thinking",
    "started_at": "2026-07-11T15:06:29.531986+00:00",
    "completed_at": "2026-07-11T15:29:30.542542+00:00",
    "status": "success"
  },
  "benchmark": {
    "task": "alman_bench",
    "dataset": "curated",
    "sample_count": 48,
    "spec_in_context": true,
    "spec_examples_in_dataset": false,
    "commit": "1ce9ba9513bcc0d6a5cc2886705c38374a04b7df",
    "working_tree_dirty": false
  },
  "model": {
    "repository": "zai-org/GLM-5.2",
    "hub_revision": "b4734de4facf877f85769a911abafc5283eab3d9",
    "provider_model_id": "zai-org/glm-5.2",
    "served_revision_pinned": false,
    "thinking": {
      "enabled": true,
      "mode": "think",
      "provider_control": "enable_thinking=true",
      "thinking_call_max_tokens": 4096,
      "samples_with_reasoning": 48,
      "max_thinking_call_completion_tokens": 4096,
      "max_reported_reasoning_tokens": 2387,
      "forced_final_fallback_count": 4,
      "forced_final_fallback_disables_thinking": true
    }
  },
  "endpoint": {
    "platform": "huggingface-inference-providers",
    "provider": "novita",
    "api": "chat_completions",
    "routing": "explicit-client-provider"
  },
  "generation": {
    "temperature": 1.0,
    "top_p": 1.0,
    "thinking_call_max_tokens": 4096,
    "forced_final_max_tokens": 512,
    "max_retries": 2
  },
  "results": {
    "acceptance": {
      "correct": 39,
      "total": 48,
      "rate": 0.8125,
      "stderr": 0.05633673867912483
    },
    "compliance": {
      "correct": 47,
      "total": 48,
      "rate": 0.9791666666666666,
      "stderr": 0.020615177234440847
    },
    "groups": {
      "ablaut": {
        "correct": 2,
        "total": 2,
        "rate": 1.0,
        "stderr": 0.0
      },
      "berufe": {
        "correct": 5,
        "total": 5,
        "rate": 1.0,
        "stderr": 0.0
      },
      "deutsch-alman": {
        "correct": 11,
        "total": 11,
        "rate": 1.0,
        "stderr": 0.0
      },
      "die-verwandlung": {
        "correct": 2,
        "total": 4,
        "rate": 0.5,
        "stderr": 0.25
      },
      "siddhartha": {
        "correct": 10,
        "total": 16,
        "rate": 0.625,
        "stderr": 0.12103072956898178
      },
      "starke-flexion": {
        "correct": 8,
        "total": 8,
        "rate": 1.0,
        "stderr": 0.0
      },
      "steppenwolf": {
        "correct": 1,
        "total": 2,
        "rate": 0.5,
        "stderr": 0.3535533905932738
      }
    },
    "tokens": {
      "input": 662464,
      "output": 57216,
      "reasoning": 4504,
      "total": 719680
    },
    "estimated_cost_usd": 1.1792
  },
  "pricing": {
    "currency": "USD",
    "input_per_million_tokens": 1.4,
    "output_per_million_tokens": 4.4,
    "observed_at": "2026-07-11T14:55:00Z"
  },
  "artifacts": {
    "samples_jsonl": "/home/onur/scratch/alman-benchmark-runs/hf-providers/20260711T150629Z/glm-5.2-hf-novita-thinking.samples.jsonl"
  }
}
