{
  "$schema": "./hosted-result.schema.json",
  "schema_version": 1,
  "run": {
    "id": "20260712T093928Z-step3.7-flash-hf-deepinfra-thinking",
    "started_at": "2026-07-12T09:39:28.796070+00:00",
    "completed_at": "2026-07-12T09:44:46.960275+00:00",
    "status": "success"
  },
  "benchmark": {
    "task": "alman_bench",
    "dataset": "curated",
    "sample_count": 48,
    "spec_in_context": true,
    "spec_examples_in_dataset": false,
    "commit": "9dce7f507e5e767e3bdbae034002d1323fa275b0",
    "working_tree_dirty": false
  },
  "model": {
    "repository": "stepfun-ai/Step-3.7-Flash",
    "hub_revision": "5f6244077ac62e04eec3f320501ff8c2b293373a",
    "provider_model_id": "stepfun-ai/Step-3.7-Flash",
    "served_revision_pinned": false,
    "thinking": {
      "enabled": true,
      "mode": "think",
      "provider_control": "chat_template_kwargs.reasoning_effort=high",
      "thinking_call_max_tokens": 4096,
      "samples_with_reasoning": 48,
      "max_thinking_call_completion_tokens": 4096,
      "max_reported_reasoning_tokens": null,
      "forced_final_fallback_count": 10,
      "forced_final_fallback_disables_thinking": true
    }
  },
  "endpoint": {
    "platform": "huggingface-inference-providers",
    "provider": "deepinfra",
    "api": "chat_completions",
    "routing": "explicit-client-provider",
    "max_concurrency": 4
  },
  "generation": {
    "temperature": 1.0,
    "top_p": 0.95,
    "presence_penalty": null,
    "thinking_call_max_tokens": 4096,
    "forced_final_max_tokens": 512,
    "forced_final_strategy": "continue-prefilled-answer",
    "forced_final_output_field": "reasoning",
    "max_retries": 2
  },
  "results": {
    "acceptance": {
      "correct": 36,
      "total": 48,
      "rate": 0.75,
      "stderr": 0.0625
    },
    "compliance": {
      "correct": 45,
      "total": 48,
      "rate": 0.9375,
      "stderr": 0.034938562148434216
    },
    "groups": {
      "ablaut": {
        "correct": 2,
        "total": 2,
        "rate": 1.0,
        "stderr": 0.0
      },
      "berufe": {
        "correct": 4,
        "total": 5,
        "rate": 0.8,
        "stderr": 0.17888543819998315
      },
      "deutsch-alman": {
        "correct": 11,
        "total": 11,
        "rate": 1.0,
        "stderr": 0.0
      },
      "die-verwandlung": {
        "correct": 1,
        "total": 4,
        "rate": 0.25,
        "stderr": 0.21650635094610965
      },
      "siddhartha": {
        "correct": 10,
        "total": 16,
        "rate": 0.625,
        "stderr": 0.12103072956898178
      },
      "starke-flexion": {
        "correct": 8,
        "total": 8,
        "rate": 1.0,
        "stderr": 0.0
      },
      "steppenwolf": {
        "correct": 0,
        "total": 2,
        "rate": 0.0,
        "stderr": 0.0
      }
    },
    "tokens": {
      "input": 771474,
      "output": 89558,
      "reasoning": null,
      "total": 861032
    },
    "estimated_cost_usd": 0.2572865
  },
  "pricing": {
    "currency": "USD",
    "input_per_million_tokens": 0.2,
    "output_per_million_tokens": 1.15,
    "observed_at": "2026-07-12T09:00:00Z"
  },
  "artifacts": {
    "samples_jsonl": "/home/onur/scratch/alman-benchmark-runs/hf-providers/20260712T103000Z-step-prefilled-final/step3.7-flash-hf-deepinfra-thinking.samples.jsonl"
  }
}
